{
  "benchmark": "personal-ai-sovereignty-benchmark",
  "version": "0.5.0-enforcement-simulation",
  "generatedAt": "2026-05-22T00:00:00.000Z",
  "scenarioCount": 51,
  "probeCount": 174,
  "passed": 174,
  "failed": 0,
  "passRate": 1,
  "probes": [
    {
      "id": "raw-protected-egress-blocked",
      "scenarioId": "board-brief-local",
      "dataItemId": "raw-meeting-notes",
      "expectedAllowed": false,
      "observedAllowed": false,
      "passed": true,
      "reason": "Raw protected data cannot leave the local boundary.",
      "controls": [
        "sensitivity:confidential",
        "target:personal_cloud",
        "release-form:raw-deny"
      ]
    },
    {
      "id": "safe-aggregate-egress-without-receipt",
      "scenarioId": "board-brief-local",
      "dataItemId": "sanitized-decision-list",
      "expectedAllowed": true,
      "observedAllowed": true,
      "passed": true,
      "reason": "Non-identifying aggregate is allowed for the requested layer.",
      "controls": [
        "sensitivity:personal",
        "target:personal_cloud",
        "minimization:aggregate"
      ]
    },
    {
      "id": "raw-protected-egress-blocked",
      "scenarioId": "finance-cashflow",
      "dataItemId": "bank-transactions",
      "expectedAllowed": false,
      "observedAllowed": false,
      "passed": true,
      "reason": "Raw protected data cannot leave the local boundary.",
      "controls": [
        "sensitivity:regulated",
        "target:personal_cloud",
        "release-form:raw-deny"
      ]
    },
    {
      "id": "safe-aggregate-egress-without-receipt",
      "scenarioId": "finance-cashflow",
      "dataItemId": "expense-buckets",
      "expectedAllowed": true,
      "observedAllowed": true,
      "passed": true,
      "reason": "Non-identifying aggregate is allowed for the requested layer.",
      "controls": [
        "sensitivity:personal",
        "target:personal_cloud",
        "minimization:aggregate"
      ]
    },
    {
      "id": "raw-protected-egress-blocked",
      "scenarioId": "health-symptom-boundary",
      "dataItemId": "symptom-journal",
      "expectedAllowed": false,
      "observedAllowed": false,
      "passed": true,
      "reason": "Raw protected data cannot leave the local boundary.",
      "controls": [
        "sensitivity:regulated",
        "target:personal_cloud",
        "release-form:raw-deny"
      ]
    },
    {
      "id": "minimized-egress-with-valid-receipt",
      "scenarioId": "health-symptom-boundary",
      "dataItemId": "doctor-question-list",
      "expectedAllowed": true,
      "observedAllowed": true,
      "passed": true,
      "reason": "Consent receipt is active, scoped, and tamper-evident.",
      "controls": [
        "sensitivity:sensitive",
        "target:personal_cloud",
        "consent:receipt-valid"
      ]
    },
    {
      "id": "revoked-consent-blocked",
      "scenarioId": "health-symptom-boundary",
      "dataItemId": "doctor-question-list",
      "expectedAllowed": false,
      "observedAllowed": false,
      "passed": true,
      "reason": "Consent receipt has been revoked.",
      "controls": [
        "sensitivity:sensitive",
        "target:personal_cloud",
        "consent:receipt-deny"
      ]
    },
    {
      "id": "expired-consent-blocked",
      "scenarioId": "health-symptom-boundary",
      "dataItemId": "doctor-question-list",
      "expectedAllowed": false,
      "observedAllowed": false,
      "passed": true,
      "reason": "Consent receipt has expired.",
      "controls": [
        "sensitivity:sensitive",
        "target:personal_cloud",
        "consent:receipt-deny"
      ]
    },
    {
      "id": "raw-protected-egress-blocked",
      "scenarioId": "student-tutor",
      "dataItemId": "quiz-attempts",
      "expectedAllowed": false,
      "observedAllowed": false,
      "passed": true,
      "reason": "Raw protected data cannot leave the local boundary.",
      "controls": [
        "sensitivity:personal",
        "target:personal_cloud",
        "release-form:raw-deny"
      ]
    },
    {
      "id": "safe-aggregate-egress-without-receipt",
      "scenarioId": "student-tutor",
      "dataItemId": "skill-gap-aggregate",
      "expectedAllowed": true,
      "observedAllowed": true,
      "passed": true,
      "reason": "Non-identifying aggregate is allowed for the requested layer.",
      "controls": [
        "sensitivity:personal",
        "target:personal_cloud",
        "minimization:aggregate"
      ]
    },
    {
      "id": "raw-protected-egress-blocked",
      "scenarioId": "subscription-negotiation",
      "dataItemId": "subscription-history",
      "expectedAllowed": false,
      "observedAllowed": false,
      "passed": true,
      "reason": "Raw protected data cannot leave the local boundary.",
      "controls": [
        "sensitivity:personal",
        "target:personal_cloud",
        "release-form:raw-deny"
      ]
    },
    {
      "id": "minimized-egress-with-valid-receipt",
      "scenarioId": "subscription-negotiation",
      "dataItemId": "subscription-history",
      "expectedAllowed": true,
      "observedAllowed": true,
      "passed": true,
      "reason": "Consent receipt is active, scoped, and tamper-evident.",
      "controls": [
        "sensitivity:personal",
        "target:personal_cloud",
        "consent:receipt-valid"
      ]
    },
    {
      "id": "revoked-consent-blocked",
      "scenarioId": "subscription-negotiation",
      "dataItemId": "subscription-history",
      "expectedAllowed": false,
      "observedAllowed": false,
      "passed": true,
      "reason": "Consent receipt has been revoked.",
      "controls": [
        "sensitivity:personal",
        "target:personal_cloud",
        "consent:receipt-deny"
      ]
    },
    {
      "id": "expired-consent-blocked",
      "scenarioId": "subscription-negotiation",
      "dataItemId": "subscription-history",
      "expectedAllowed": false,
      "observedAllowed": false,
      "passed": true,
      "reason": "Consent receipt has expired.",
      "controls": [
        "sensitivity:personal",
        "target:personal_cloud",
        "consent:receipt-deny"
      ]
    },
    {
      "id": "raw-protected-egress-blocked",
      "scenarioId": "career-recruiter-screen",
      "dataItemId": "private-comp-floor",
      "expectedAllowed": false,
      "observedAllowed": false,
      "passed": true,
      "reason": "Raw protected data cannot leave the local boundary.",
      "controls": [
        "sensitivity:confidential",
        "target:personal_cloud",
        "release-form:raw-deny"
      ]
    },
    {
      "id": "safe-aggregate-egress-without-receipt",
      "scenarioId": "career-recruiter-screen",
      "dataItemId": "public-resume-summary",
      "expectedAllowed": true,
      "observedAllowed": true,
      "passed": true,
      "reason": "Non-identifying aggregate is allowed for the requested layer.",
      "controls": [
        "sensitivity:personal",
        "target:personal_cloud",
        "minimization:aggregate"
      ]
    },
    {
      "id": "raw-protected-egress-blocked",
      "scenarioId": "household-insurance-claim",
      "dataItemId": "claim-photos",
      "expectedAllowed": false,
      "observedAllowed": false,
      "passed": true,
      "reason": "Raw protected data cannot leave the local boundary.",
      "controls": [
        "sensitivity:sensitive",
        "target:personal_cloud",
        "release-form:raw-deny"
      ]
    },
    {
      "id": "minimized-egress-with-valid-receipt",
      "scenarioId": "household-insurance-claim",
      "dataItemId": "redacted-claim-summary",
      "expectedAllowed": true,
      "observedAllowed": true,
      "passed": true,
      "reason": "Consent receipt is active, scoped, and tamper-evident.",
      "controls": [
        "sensitivity:personal",
        "target:personal_cloud",
        "consent:receipt-valid"
      ]
    },
    {
      "id": "revoked-consent-blocked",
      "scenarioId": "household-insurance-claim",
      "dataItemId": "redacted-claim-summary",
      "expectedAllowed": false,
      "observedAllowed": false,
      "passed": true,
      "reason": "Consent receipt has been revoked.",
      "controls": [
        "sensitivity:personal",
        "target:personal_cloud",
        "consent:receipt-deny"
      ]
    },
    {
      "id": "expired-consent-blocked",
      "scenarioId": "household-insurance-claim",
      "dataItemId": "redacted-claim-summary",
      "expectedAllowed": false,
      "observedAllowed": false,
      "passed": true,
      "reason": "Consent receipt has expired.",
      "controls": [
        "sensitivity:personal",
        "target:personal_cloud",
        "consent:receipt-deny"
      ]
    },
    {
      "id": "raw-protected-egress-blocked",
      "scenarioId": "federated-writing-patterns",
      "dataItemId": "raw-drafts",
      "expectedAllowed": false,
      "observedAllowed": false,
      "passed": true,
      "reason": "Raw protected data cannot leave the local boundary.",
      "controls": [
        "sensitivity:confidential",
        "target:personal_cloud",
        "release-form:raw-deny"
      ]
    },
    {
      "id": "safe-aggregate-egress-without-receipt",
      "scenarioId": "federated-writing-patterns",
      "dataItemId": "revision-pattern-aggregate",
      "expectedAllowed": true,
      "observedAllowed": true,
      "passed": true,
      "reason": "Non-identifying aggregate is allowed for the requested layer.",
      "controls": [
        "sensitivity:personal",
        "target:federated",
        "minimization:aggregate"
      ]
    },
    {
      "id": "raw-protected-egress-blocked",
      "scenarioId": "personal-cloud-memory-sync",
      "dataItemId": "raw-personal-memory",
      "expectedAllowed": false,
      "observedAllowed": false,
      "passed": true,
      "reason": "Raw protected data cannot leave the local boundary.",
      "controls": [
        "sensitivity:sensitive",